[{'full_name': 'Общество с ограниченной ответственностью «Торговый дом «Энергоимпорт»', 'short_name': 'ООО «ТД «Энергоимпорт»', 'inn': '7702758341', 'ogrn': '1117746257640', 'last_modified': '2019-06-21T15:08:59.507', 'address': '119334, г Москва, Гагаринский р-н, ул Косыгина, д 5, помещ V ком 10'}]
"[{'full_name': 'Общество с ограниченной ответственностью ""Альянс""'"," 'short_name': 'ООО ""Альянс""'", 'inn': '7802654025', 'ogrn': '1187847030194', 'last_modified': '2018-06-13T11:28:49.160', 'address': '197022, г Санкт-Петербург, Петроградский р-н, ул Профессора Попова, д 41/5 литера а, помещ 3Н офис 1'}]
"[{'full_name': 'Общество с ограниченной ответственностью ""Содействиет""'"," 'short_name': 'ООО ""Содействие""'", 'inn': '5027217264', 'ogrn': '1145027017618', 'last_modified': '2015-09-18T16:16:46.427', 'address': '140000, Московская обл, г Люберцы, Октябрьский пр-кт, д 249, помещ 22 офис 3'}]
"[{'full_name': 'ОБЩЕСТВО С ОГРАНИЧЕННОЙ ОТВЕТСТВЕННОСТЬЮ ""ЭКСПЕРТ-ЦЕНТР""'", 'short_name': 'ООО «Эксперт-Центр» ', 'inn': '6324042940', 'ogrn': '1136324009326', 'last_modified': '2014-04-14T16:49:34.757', 'address': '445054, Самарская обл, г Тольятти, Центральный р-н, ул Карбышева, д 12, ком 10'}]
"[{'full_name': 'Общество с ограниченной ответственностью""Центр правовой поддержки""'"," 'short_name': 'ООО ""Центр правовой поддержки""'", 'inn': '5834031870', 'ogrn': '1055802033737', 'last_modified': '2012-08-03T16:17:12.730', 'address': '440023, Пензенская обл, г Пенза, Железнодорожный р-н, ул Стрельбищенская, д 60, офис 303'}]
"[{'full_name': 'Общество с ограниченной ответственностью ""ИНФО-БИЗНЕС""'"," 'short_name': 'ООО ""ИНФО-БИЗНЕС""'", 'inn': '1657061756', 'ogrn': '1061685050350', 'last_modified': '2011-09-02T09:54:46.470', 'address': '420095, Респ Татарстан, г Казань, Московский р-н, ул Энергетиков, д 2, офис 17'}]
"[{'full_name': 'Общество с ограниченной ответственностью ""Финэкс""'"," 'short_name': 'ООО ""Финэкс""'", 'inn': '3665044042', 'ogrn': '1043600013929', 'last_modified': '2011-04-05T10:01:42.537', 'address': '394038, Воронежская обл, г Воронеж, ул Дорожная, д 18, офис 7'}]
[{'full_name': 'Общество с ограниченной ответственностью «Центр коммерческой деятельности»', 'short_name': 'ООО «ЦКД»', 'inn': '6453102410', 'ogrn': '1086453005594', 'last_modified': '2011-04-14T16:27:32.030', 'address': '410033, Саратовская обл, г Саратов, Ленинский р-н, пр-кт им 50 лет Октября, д 101'}]
